Author;Title;Co-Authors;No Authors;Year;Pagination
https://dblp.uni-trier.de/pid/13/1566.html;Extended Context-Free Grammars and Normal Form Algorithms.;['https://dblp.uni-trier.de/pid/00/5474.html', 'https://dblp.uni-trier.de/pid/w/DerickWood.html'];3;1998;1-12
https://dblp.uni-trier.de/pid/32/1457.html;Variable and Clause Ordering in an FSA Approach to Propositional Satisfiability.;['https://dblp.uni-trier.de/pid/29/9960.html'];2;2011;76-87
https://dblp.uni-trier.de/pid/32/1457.html;LR Parsing for Global Index Languages (GILs).;[];1;2003;269-281
https://dblp.uni-trier.de/pid/16/2622.html;Regular Geometrical Languages and Tiling the Plane.;['https://dblp.uni-trier.de/pid/30/6143.html', 'https://dblp.uni-trier.de/pid/86/106.html'];3;2010;69-78
https://dblp.uni-trier.de/pid/16/2622.html;Testing Whether a Binary and Prolongeable Regular Language LIs Geometrical or Not on the Minimal Deterministic Automaton of Pref(L).;['https://dblp.uni-trier.de/pid/30/6143.html', 'https://dblp.uni-trier.de/pid/86/106.html'];3;2008;68-77
https://dblp.uni-trier.de/pid/147/8451.html;Bounded Prefix-Suffix Duplication.;['https://dblp.uni-trier.de/pid/15/7673.html', 'https://dblp.uni-trier.de/pid/67/4899.html', 'https://dblp.uni-trier.de/pid/86/4985.html'];4;2014;176-187
https://dblp.uni-trier.de/pid/81/5510.html;Automata-Based Termination Proofs.;['https://dblp.uni-trier.de/pid/87/2946.html'];2;2009;165-177
https://dblp.uni-trier.de/pid/80/2956.html;Dolev-Yao Theory with Associative Blindpair Operators.;['https://dblp.uni-trier.de/pid/36/5799.html', 'https://dblp.uni-trier.de/pid/34/6797.html'];3;2019;58-69
https://dblp.uni-trier.de/pid/80/2956.html;An Automaton Model of User-Controlled Navigation on the Web.;['https://dblp.uni-trier.de/pid/l/KamalLodaya.html'];2;2000;208-216
https://dblp.uni-trier.de/pid/19/4109.html;Branching Automata with Costs - A Way of Reflecting Parallelism in Costs.;['https://dblp.uni-trier.de/pid/12/2285.html'];2;2003;150-162
https://dblp.uni-trier.de/pid/09/4143.html;Finite Automata for Compact Representation of Language Models in NLP.;['https://dblp.uni-trier.de/pid/89/931.html'];2;2001;65-73
https://dblp.uni-trier.de/pid/09/4143.html;An Extendible Regular Expression Compiler for Finite-State Approaches in Natural Language Processing.;['https://dblp.uni-trier.de/pid/33/2120.html'];2;1999;122-139
https://dblp.uni-trier.de/pid/09/4143.html;FSA Utilities: A Toolbox to Manipulate Finite-State Automata.;[];1;1996;87-108
https://dblp.uni-trier.de/pid/l/ThierryLecroq.html;A Fast Suffix Automata Based Algorithm for Exact Online String Matching.;['https://dblp.uni-trier.de/pid/92/5606.html'];2;2012;149-158
https://dblp.uni-trier.de/pid/84/1150.html;The Constrained Longest Common Subsequence Problem for Degenerate Strings.;['https://dblp.uni-trier.de/pid/i/CSIliopoulos.html', 'https://dblp.uni-trier.de/pid/r/MohammadSohelRahman.html', 'https://dblp.uni-trier.de/pid/95/5508.html'];4;2007;309-311
https://dblp.uni-trier.de/pid/37/153.html;On Comparing Deterministic Finite Automata and the Shuffle of Words.;['https://dblp.uni-trier.de/pid/85/1477.html'];2;2014;98-109
https://dblp.uni-trier.de/pid/55/5062.html;On the Hardness of Priority Synthesis.;['https://dblp.uni-trier.de/pid/64/3701.html', 'https://dblp.uni-trier.de/pid/70/6638.html', 'https://dblp.uni-trier.de/pid/k/AloisKnoll.html'];4;2011;110-117
https://dblp.uni-trier.de/pid/41/4735.html;Cover Languages and Implementations.;[];1;2013;1
https://dblp.uni-trier.de/pid/41/4735.html;An Incremental Algorithm for Constructing Minimal Deterministic Finite Cover Automata.;['https://dblp.uni-trier.de/pid/93/263.html', 'https://dblp.uni-trier.de/pid/59/3307.html'];3;2005;90-103
https://dblp.uni-trier.de/pid/41/4735.html;Tight Bounds for NFA to DFCA Transformations for Binary Alphabets.;['https://dblp.uni-trier.de/pid/93/263.html'];2;2004;306-307
https://dblp.uni-trier.de/pid/41/4735.html;The Number of Similarity Relations and the Number of Minimal Deterministic Finite Cover Automata.;['https://dblp.uni-trier.de/pid/93/263.html'];2;2002;67-76
https://dblp.uni-trier.de/pid/41/4735.html;Regex and Extended Regex.;['https://dblp.uni-trier.de/pid/02/6009.html', 'https://dblp.uni-trier.de/pid/y/ShengYu.html'];3;2002;77-84
https://dblp.uni-trier.de/pid/41/4735.html;State Complexity of Basic Operations on Finite Languages.;['https://dblp.uni-trier.de/pid/c/KarelCulikII.html', 'https://dblp.uni-trier.de/pid/02/6009.html', 'https://dblp.uni-trier.de/pid/y/ShengYu.html'];4;1999;60-70
https://dblp.uni-trier.de/pid/41/4735.html;Minimal Cover-Automata for Finite Languages.;['https://dblp.uni-trier.de/pid/s/NicolaeSantean.html', 'https://dblp.uni-trier.de/pid/y/ShengYu.html'];3;1998;43-56
https://dblp.uni-trier.de/pid/154/2814.html;Enumerated Automata Implementation of String Dictionaries.;['https://dblp.uni-trier.de/pid/244/2665.html', 'https://dblp.uni-trier.de/pid/06/5386.html'];3;2019;33-44
https://dblp.uni-trier.de/pid/59/2178.html;Synthesizing State-Based Object Systems from LSC Specifications.;['https://dblp.uni-trier.de/pid/h/DavidHarel.html'];2;2000;1-33
https://dblp.uni-trier.de/pid/75/5525.html;Z-Automata for Compact and Direct Representation of Unranked Tree Languages.;['https://dblp.uni-trier.de/pid/d/FrankDrewes.html', 'https://dblp.uni-trier.de/pid/69/6644.html'];3;2019;83-94
https://dblp.uni-trier.de/pid/75/5525.html;A Comparison of Two N-Best Extraction Methods for Weighted Tree Automata.;['https://dblp.uni-trier.de/pid/d/FrankDrewes.html', 'https://dblp.uni-trier.de/pid/37/2510.html'];3;2018;97-108
https://dblp.uni-trier.de/pid/75/5525.html;On the Regularity and Learnability of Ordered DAG Languages.;['https://dblp.uni-trier.de/pid/24/853.html', 'https://dblp.uni-trier.de/pid/133/7342.html'];3;2017;27-39
https://dblp.uni-trier.de/pid/75/5525.html;Deterministic Stack Transducers.;['https://dblp.uni-trier.de/pid/84/2622.html', 'https://dblp.uni-trier.de/pid/k/MartinKutrib.html'];3;2016;27-38
https://dblp.uni-trier.de/pid/75/5525.html;Backward and Forward Bisimulation Minimisation of Tree Automata.;['https://dblp.uni-trier.de/pid/48/3591.html', 'https://dblp.uni-trier.de/pid/00/4758.html'];3;2007;109-121
https://dblp.uni-trier.de/pid/75/5525.html;Bisimulation Minimization of Tree Automata.;['https://dblp.uni-trier.de/pid/a/PAAbdulla.html', 'https://dblp.uni-trier.de/pid/34/5632.html'];3;2006;173-185
https://dblp.uni-trier.de/pid/75/5525.html;Wind in the Willows - Generating Music by Means of Tree Transducers.;[];1;2005;153-162
https://dblp.uni-trier.de/pid/85/1477.html;Semilinearity of Families of Languages.;['https://dblp.uni-trier.de/pid/i/OscarHIbarra.html'];2;2018;211-222
https://dblp.uni-trier.de/pid/85/1477.html;On Bounded Semilinear Languages, Counter Machines, and Finite-Index ET0L.;['https://dblp.uni-trier.de/pid/i/OscarHIbarra.html'];2;2016;138-149
https://dblp.uni-trier.de/pid/85/1477.html;On Comparing Deterministic Finite Automata and the Shuffle of Words.;['https://dblp.uni-trier.de/pid/37/153.html'];2;2014;98-109
https://dblp.uni-trier.de/pid/85/1477.html;Viral Gene Compression: Complexity and Verification.;['https://dblp.uni-trier.de/pid/d/MarkDaley.html'];2;2004;102-112
https://dblp.uni-trier.de/pid/85/1477.html;Bag Automata and Stochastic Retrieval of Biomolecules in Solution.;['https://dblp.uni-trier.de/pid/d/MarkDaley.html', 'https://dblp.uni-trier.de/pid/78/3954.html'];3;2003;239-250
https://dblp.uni-trier.de/pid/05/1762.html;Minimization of Non-deterministic Automata with Large Alphabets.;['https://dblp.uni-trier.de/pid/a/PAAbdulla.html', 'https://dblp.uni-trier.de/pid/76/2580.html', 'https://dblp.uni-trier.de/pid/34/5632.html'];4;2005;31-42
https://dblp.uni-trier.de/pid/31/7223.html;Complexity Results and the Growths of Hairpin Completions of Regular Languages (Extended Abstract).;['https://dblp.uni-trier.de/pid/d/VolkerDiekert.html'];2;2010;105-114
https://dblp.uni-trier.de/pid/v/JesusVilares.html;Robust Spelling Correction.;['https://dblp.uni-trier.de/pid/v/MVilaresF.html', 'https://dblp.uni-trier.de/pid/o/JOteroP.html'];3;2005;319-328
https://dblp.uni-trier.de/pid/v/JesusVilares.html;Robust Parsing Using Dynamic Programming.;['https://dblp.uni-trier.de/pid/v/MVilaresF.html', 'https://dblp.uni-trier.de/pid/75/5475.html', 'https://dblp.uni-trier.de/pid/19/892.html'];4;2003;258-268
https://dblp.uni-trier.de/pid/v/JesusVilares.html;Compilation of Constraint-Based Contextual Rules for Part-of-Speech Tagging into Finite State Transducers.;['https://dblp.uni-trier.de/pid/g/JorgeGranaGil.html', 'https://dblp.uni-trier.de/pid/68/2186.html'];3;2002;128-137
https://dblp.uni-trier.de/pid/42/2723.html;The Degree of Irreversibility in Deterministic Finite Automata.;['https://dblp.uni-trier.de/pid/h/MarkusHolzer1.html', 'https://dblp.uni-trier.de/pid/k/MartinKutrib.html'];3;2016;15-26
https://dblp.uni-trier.de/pid/54/4061.html;On Parsing LL-Languages.;[];1;1998;13-21
https://dblp.uni-trier.de/pid/03/3582.html;A Completion Algorithm for Lattice Tree Automata.;['https://dblp.uni-trier.de/pid/48/4007.html', 'https://dblp.uni-trier.de/pid/52/579.html', 'https://dblp.uni-trier.de/pid/24/10259.html'];4;2013;134-145
https://dblp.uni-trier.de/pid/12/3055.html;On-the-Fly Branching Bisimulation Minimization for Compositional Analysis.;['https://dblp.uni-trier.de/pid/88/4294.html', 'https://dblp.uni-trier.de/pid/85/1157.html'];3;2006;219-229
https://dblp.uni-trier.de/pid/34/5632.html;Composed Bisimulation for Tree Automata.;['https://dblp.uni-trier.de/pid/a/PAAbdulla.html', 'https://dblp.uni-trier.de/pid/b/AhmedBouajjani.html', 'https://dblp.uni-trier.de/pid/64/6177.html', 'https://dblp.uni-trier.de/pid/51/533.html'];5;2008;212-222
https://dblp.uni-trier.de/pid/34/5632.html;Bisimulation Minimization of Tree Automata.;['https://dblp.uni-trier.de/pid/a/PAAbdulla.html', 'https://dblp.uni-trier.de/pid/75/5525.html'];3;2006;173-185
https://dblp.uni-trier.de/pid/34/5632.html;Minimization of Non-deterministic Automata with Large Alphabets.;['https://dblp.uni-trier.de/pid/a/PAAbdulla.html', 'https://dblp.uni-trier.de/pid/76/2580.html', 'https://dblp.uni-trier.de/pid/05/1762.html'];4;2005;31-42
https://dblp.uni-trier.de/pid/s/KUSchulz.html;A Simple Method for Building Bimachines from Functional Finite-State Transducers.;['https://dblp.uni-trier.de/pid/49/637.html', 'https://dblp.uni-trier.de/pid/67/6448.html'];3;2017;113-125
https://dblp.uni-trier.de/pid/07/5192.html;Synchronization of Automata with One Undefined or Ambiguous Transition.;[];1;2012;278-288
https://dblp.uni-trier.de/pid/07/5192.html;Complexity of Problems Concerning Reset Words for Cyclic and Eulerian Automata.;[];1;2011;238-249
https://dblp.uni-trier.de/pid/165/8694.html;Deciding Synchronous Kleene Algebra with Derivatives.;['https://dblp.uni-trier.de/pid/42/4087.html', 'https://dblp.uni-trier.de/pid/19/7.html', 'https://dblp.uni-trier.de/pid/n/NelmaMoreira.html'];4;2015;49-62
https://dblp.uni-trier.de/pid/01/880.html;State Complexity of Concatenation and Complementation of Regular Languages.;['https://dblp.uni-trier.de/pid/45/123.html', 'https://dblp.uni-trier.de/pid/j/GJiraskova.html'];3;2004;178-189
https://dblp.uni-trier.de/pid/77/5783.html;Large-Scale Training of SVMs with Automata Kernels.;['https://dblp.uni-trier.de/pid/85/2685.html', 'https://dblp.uni-trier.de/pid/03/5448.html'];3;2010;17-27
https://dblp.uni-trier.de/pid/77/5783.html;On the Computation of Some Standard Distances Between Probabilistic Automata.;['https://dblp.uni-trier.de/pid/03/5448.html', 'https://dblp.uni-trier.de/pid/59/1067.html'];3;2006;137-149
https://dblp.uni-trier.de/pid/10/695-4.html;Enhancements of Partitioning Techniques for Image Compression Using Weighted Finite Automata.;['https://dblp.uni-trier.de/pid/09/6913.html', 'https://dblp.uni-trier.de/pid/13/6695.html'];3;2001;177-189
https://dblp.uni-trier.de/pid/10/4341.html;LALBLC A Program Testing the Equivalence of dpda's.;['https://dblp.uni-trier.de/pid/38/4510.html'];2;2013;169-180
https://dblp.uni-trier.de/pid/93/8654.html;Stamina: Stabilisation Monoids in Automata Theory.;['https://dblp.uni-trier.de/pid/22/250.html', 'https://dblp.uni-trier.de/pid/140/7385.html', 'https://dblp.uni-trier.de/pid/21/8279.html'];4;2017;101-112
https://dblp.uni-trier.de/pid/67/335.html;Compact Normal Form for Regular Languages as Xor Automata.;['https://dblp.uni-trier.de/pid/49/4575.html'];2;2009;24-33
https://dblp.uni-trier.de/pid/00/5897.html;A New Hierarchy for Automaton Semigroups.;['https://dblp.uni-trier.de/pid/64/3883.html', 'https://dblp.uni-trier.de/pid/153/1880.html', 'https://dblp.uni-trier.de/pid/12/1449.html'];4;2018;71-83
https://dblp.uni-trier.de/pid/00/5897.html;Implementing Computations in Automaton (Semi)groups.;['https://dblp.uni-trier.de/pid/12/1449.html', 'https://dblp.uni-trier.de/pid/87/1132.html'];3;2012;240-252
https://dblp.uni-trier.de/pid/01/4421.html;Observations on Determinization of Büchi Automata.;['https://dblp.uni-trier.de/pid/t/WolfgangThomas.html', 'https://dblp.uni-trier.de/pid/76/5200.html'];3;2005;262-272
https://dblp.uni-trier.de/pid/57/9125.html;Transductions Computed by PC-Systems of Monotone Deterministic Restarting Automata.;['https://dblp.uni-trier.de/pid/27/9125.html', 'https://dblp.uni-trier.de/pid/03/67.html'];3;2010;163-172
https://dblp.uni-trier.de/pid/87/2946.html;Automata-Based Termination Proofs.;['https://dblp.uni-trier.de/pid/81/5510.html'];2;2009;165-177
https://dblp.uni-trier.de/pid/08/10670.html;Solving Parity Games Using an Automata-Based Algorithm.;['https://dblp.uni-trier.de/pid/157/8638.html', 'https://dblp.uni-trier.de/pid/41/1330.html', 'https://dblp.uni-trier.de/pid/v/MosheYVardi.html'];4;2016;64-76
https://dblp.uni-trier.de/pid/73/924.html;Algorithms for Weighted Finite Automata with Failure Transitions.;['https://dblp.uni-trier.de/pid/85/2685.html'];2;2018;46-58
https://dblp.uni-trier.de/pid/73/924.html;On the Disambiguation of Weighted Automata.;['https://dblp.uni-trier.de/pid/03/5448.html'];2;2015;263-278
https://dblp.uni-trier.de/pid/73/924.html;A Pushdown Transducer Extension for the OpenFst Library.;['https://dblp.uni-trier.de/pid/85/2685.html'];2;2012;66-77
https://dblp.uni-trier.de/pid/73/924.html;Filters for Efficient Composition of Weighted Finite-State Transducers.;['https://dblp.uni-trier.de/pid/85/2685.html', 'https://dblp.uni-trier.de/pid/98/6688.html'];3;2010;28-38
https://dblp.uni-trier.de/pid/73/924.html;OpenFst: A General and Efficient Weighted Finite-State Transducer Library.;['https://dblp.uni-trier.de/pid/85/2685.html', 'https://dblp.uni-trier.de/pid/98/6688.html', 'https://dblp.uni-trier.de/pid/74/4110.html', 'https://dblp.uni-trier.de/pid/03/5448.html'];5;2007;11-23
https://dblp.uni-trier.de/pid/73/924.html;A Rational Design for a Weighted Finite-State Transducer Library.;['https://dblp.uni-trier.de/pid/03/5448.html', 'https://dblp.uni-trier.de/pid/p/FernandoCNPereira.html'];3;1997;144-158
https://dblp.uni-trier.de/pid/t/AvrahamTrakhtman.html;Reducing the Time Complexity of Testing for Local Threshold Testability.;[];1;2003;141-149
https://dblp.uni-trier.de/pid/t/AvrahamTrakhtman.html;A Polynomial Time Algorithm for Left [Right] Local Testability.;[];1;2002;203-212
https://dblp.uni-trier.de/pid/t/AvrahamTrakhtman.html;A Package TESTAS for Checking Some Kinds of Testability.;[];1;2002;228-232
https://dblp.uni-trier.de/pid/t/AvrahamTrakhtman.html;An Algorithm to Verify Local Threshold Testability of Deterministic Finite Automata.;[];1;1999;164-173
https://dblp.uni-trier.de/pid/t/AvrahamTrakhtman.html;A Precise Estimation of the Order of Local Testability of a Deterministic Finite Automaton.;[];1;1997;198-212
https://dblp.uni-trier.de/pid/j/HJurgensen.html;Automata for Codes.;[];1;2013;2-15
https://dblp.uni-trier.de/pid/j/HJurgensen.html;Finite Automata Encoding Geometric Figures.;['https://dblp.uni-trier.de/pid/s/LudwigStaiger.html'];2;1999;101-108
https://dblp.uni-trier.de/pid/120/6413.html;Regular Expressions and Transducers over Alphabet-Invariant and User-Defined Labels.;['https://dblp.uni-trier.de/pid/k/StavrosKonstantinidis.html', 'https://dblp.uni-trier.de/pid/n/NelmaMoreira.html', 'https://dblp.uni-trier.de/pid/30/5254.html'];4;2018;4-27
https://dblp.uni-trier.de/pid/30/5254.html;Manipulation of Regular Expressions Using Derivatives: An Overview.;['https://dblp.uni-trier.de/pid/n/NelmaMoreira.html'];2;2022;19-33
https://dblp.uni-trier.de/pid/30/5254.html;Partial Derivatives of Regular Expressions over Alphabet-Invariant and User-Defined Labels.;['https://dblp.uni-trier.de/pid/k/StavrosKonstantinidis.html', 'https://dblp.uni-trier.de/pid/n/NelmaMoreira.html', 'https://dblp.uni-trier.de/pid/92/4408-2.html'];4;2019;184-196
https://dblp.uni-trier.de/pid/30/5254.html;Regular Expressions and Transducers over Alphabet-Invariant and User-Defined Labels.;['https://dblp.uni-trier.de/pid/k/StavrosKonstantinidis.html', 'https://dblp.uni-trier.de/pid/n/NelmaMoreira.html', 'https://dblp.uni-trier.de/pid/120/6413.html'];4;2018;4-27
https://dblp.uni-trier.de/pid/30/5254.html;Implementation of Code Properties via Transducers.;['https://dblp.uni-trier.de/pid/k/StavrosKonstantinidis.html', 'https://dblp.uni-trier.de/pid/162/0238.html', 'https://dblp.uni-trier.de/pid/n/NelmaMoreira.html'];4;2016;189-201
https://dblp.uni-trier.de/pid/30/5254.html;Counting Equivalent Linear Finite Transducers Using a Canonical Form.;['https://dblp.uni-trier.de/pid/118/5957.html', 'https://dblp.uni-trier.de/pid/21/4601.html'];3;2014;70-83
https://dblp.uni-trier.de/pid/30/5254.html;Partial Derivative and Position Bisimilarity Automata.;['https://dblp.uni-trier.de/pid/125/2364.html', 'https://dblp.uni-trier.de/pid/n/NelmaMoreira.html'];3;2014;264-277
https://dblp.uni-trier.de/pid/30/5254.html;Incomplete Transition Complexity of Basic Operations on Finite Languages.;['https://dblp.uni-trier.de/pid/125/2364.html', 'https://dblp.uni-trier.de/pid/n/NelmaMoreira.html'];3;2013;349-356
https://dblp.uni-trier.de/pid/30/5254.html;Incremental DFA Minimisation.;['https://dblp.uni-trier.de/pid/53/3527.html', 'https://dblp.uni-trier.de/pid/n/NelmaMoreira.html'];3;2010;39-48
https://dblp.uni-trier.de/pid/30/5254.html;FAdo and GUItar.;['https://dblp.uni-trier.de/pid/00/7175.html', 'https://dblp.uni-trier.de/pid/53/3527.html', 'https://dblp.uni-trier.de/pid/54/7174.html', 'https://dblp.uni-trier.de/pid/n/NelmaMoreira.html'];5;2009;65-74
https://dblp.uni-trier.de/pid/30/5254.html;Antimirov and Mosses's Rewrite System Revisited.;['https://dblp.uni-trier.de/pid/53/3527.html', 'https://dblp.uni-trier.de/pid/n/NelmaMoreira.html'];3;2008;46-56
https://dblp.uni-trier.de/pid/30/5254.html;Acyclic Automata with Easy-to-Find Short Regular Expressions.;['https://dblp.uni-trier.de/pid/80/2024.html', 'https://dblp.uni-trier.de/pid/n/NelmaMoreira.html'];3;2005;349-350
https://dblp.uni-trier.de/pid/79/5612.html;Brute Force Determinization of NFAs by Means of State Covers.;['https://dblp.uni-trier.de/pid/30/6143.html', 'https://dblp.uni-trier.de/pid/09/734.html'];3;2004;80-89
https://dblp.uni-trier.de/pid/53/221.html;Towards More Expressive 2D Deterministic Automata.;['https://dblp.uni-trier.de/pid/33/713.html'];2;2011;225-237
https://dblp.uni-trier.de/pid/22/1750.html;Security of Numerical Sensors in Automata.;['https://dblp.uni-trier.de/pid/51/5888.html', 'https://dblp.uni-trier.de/pid/165/8656.html', 'https://dblp.uni-trier.de/pid/164/1690.html'];4;2015;76-88
https://dblp.uni-trier.de/pid/38/6116.html;Approximation to the Smallest Regular Expression for a Given Regular Language.;['https://dblp.uni-trier.de/pid/09/3115.html'];2;2004;312-314
https://dblp.uni-trier.de/pid/59/7880.html;From Sequential Extended Regular Expressions to NFA with Symbolic Labels.;['https://dblp.uni-trier.de/pid/13/5961.html', 'https://dblp.uni-trier.de/pid/83/563.html', 'https://dblp.uni-trier.de/pid/t/StefanoTonetta.html'];4;2010;87-94
https://dblp.uni-trier.de/pid/32/618.html;Finite Automata and Unions of Regular Patterns with Bounded Constant Segments.;['https://dblp.uni-trier.de/pid/04/2667-1.html'];2;2005;104-115
https://dblp.uni-trier.de/pid/32/618.html;Is Learning RFSAs Better Than Learning DFAs?.;['https://dblp.uni-trier.de/pid/04/2667-1.html', 'https://dblp.uni-trier.de/pid/39/386-1.html', 'https://dblp.uni-trier.de/pid/97/8237.html'];4;2005;343-344
https://dblp.uni-trier.de/pid/137/8219.html;Unary Languages Recognized by Two-Way One-Counter Automata.;['https://dblp.uni-trier.de/pid/82/4618.html'];2;2014;148-161
https://dblp.uni-trier.de/pid/89/931.html;Smaller Representation of Finite State Automata.;['https://dblp.uni-trier.de/pid/09/1765.html'];2;2011;118-129
https://dblp.uni-trier.de/pid/89/931.html;An Implementation of Deterministic Tree Automata Minimization.;['https://dblp.uni-trier.de/pid/c/RCCarrasco.html', 'https://dblp.uni-trier.de/pid/07/536.html'];3;2007;122-129
https://dblp.uni-trier.de/pid/89/931.html;Incremental and Semi-incremental Construction of Pseudo-Minimal Automata.;['https://dblp.uni-trier.de/pid/60/3064.html', 'https://dblp.uni-trier.de/pid/32/6117.html'];3;2005;341-342
https://dblp.uni-trier.de/pid/89/931.html;Comparison of Construction Algorithms for Minimal, Acyclic, Deterministic, Finite-State Automata from Sets of Strings.;[];1;2002;255-261
https://dblp.uni-trier.de/pid/89/931.html;Finite Automata for Compact Representation of Language Models in NLP.;['https://dblp.uni-trier.de/pid/09/4143.html'];2;2001;65-73
https://dblp.uni-trier.de/pid/89/931.html;Experiments with Automata Compression.;[];1;2000;105-112
https://dblp.uni-trier.de/pid/89/931.html;Treatment of Unknown Words.;[];1;1999;71-80
https://dblp.uni-trier.de/pid/19/892.html;Robust Parsing Using Dynamic Programming.;['https://dblp.uni-trier.de/pid/v/MVilaresF.html', 'https://dblp.uni-trier.de/pid/75/5475.html', 'https://dblp.uni-trier.de/pid/v/JesusVilares.html'];4;2003;258-268
https://dblp.uni-trier.de/pid/l/ChristofLoding.html;Memory Reduction for Strategies in Infinite Games.;['https://dblp.uni-trier.de/pid/193/1735.html'];2;2007;253-264
https://dblp.uni-trier.de/pid/147/8529.html;Minimal Partial Languages and Automata.;['https://dblp.uni-trier.de/pid/b/FBlanchetSadri.html', 'https://dblp.uni-trier.de/pid/147/8536.html'];3;2014;110-123
https://dblp.uni-trier.de/pid/27/1726.html;: A Library to Randomly and Exhaustively Generate Automata.;['https://dblp.uni-trier.de/pid/75/2199.html', 'https://dblp.uni-trier.de/pid/28/881.html'];3;2007;303-305
https://dblp.uni-trier.de/pid/44/3505-1.html;Relational String Verification Using Multi-track Automata.;['https://dblp.uni-trier.de/pid/07/3368.html', 'https://dblp.uni-trier.de/pid/i/OscarHIbarra.html'];3;2010;290-299
https://dblp.uni-trier.de/pid/44/3505-1.html;TCTL Inevitability Analysis of Dense-Time Systems.;['https://dblp.uni-trier.de/pid/27/3868.html', 'https://dblp.uni-trier.de/pid/81/171.html'];3;2003;176-187
https://dblp.uni-trier.de/pid/96/5273.html;Tabulation of Bidirectional Push Down Automata.;['https://dblp.uni-trier.de/pid/a/MiguelAAlonso.html', 'https://dblp.uni-trier.de/pid/v/MVilaresF.html'];3;2002;35-46
https://dblp.uni-trier.de/pid/t/GabrielThierrin.html;Multiset Processing by Means of Systems of Finite State Transducers.;['https://dblp.uni-trier.de/pid/p/GPaun.html'];2;1999;140-157
https://dblp.uni-trier.de/pid/77/1610.html;Tiburon: A Weighted Tree Automata Toolkit.;['https://dblp.uni-trier.de/pid/00/4758.html'];2;2006;102-113
https://dblp.uni-trier.de/pid/132/2005.html;Partial Word DFAs.;['https://dblp.uni-trier.de/pid/132/1997.html', 'https://dblp.uni-trier.de/pid/b/FBlanchetSadri.html', 'https://dblp.uni-trier.de/pid/43/8172.html'];4;2013;36-47
https://dblp.uni-trier.de/pid/81/1215.html;FIRE Station: An Environment for Manipulating Finite Automata and Regular Expression Views.;['https://dblp.uni-trier.de/pid/c/LoekCleophas.html', 'https://dblp.uni-trier.de/pid/w/BruceWWatson.html'];3;2004;125-133
https://dblp.uni-trier.de/pid/81/1215.html;Combining Regular Expressions with (Near-)Optimal Brzozowski Automata.;['https://dblp.uni-trier.de/pid/w/BruceWWatson.html'];2;2004;319-320
https://dblp.uni-trier.de/pid/81/1215.html;The Effect of Rewriting Regular Expressions on Their Accepting Automata.;['https://dblp.uni-trier.de/pid/c/LoekCleophas.html', 'https://dblp.uni-trier.de/pid/w/BruceWWatson.html'];3;2003;304-305
https://dblp.uni-trier.de/pid/153/1880.html;A New Hierarchy for Automaton Semigroups.;['https://dblp.uni-trier.de/pid/64/3883.html', 'https://dblp.uni-trier.de/pid/12/1449.html', 'https://dblp.uni-trier.de/pid/00/5897.html'];4;2018;71-83
https://dblp.uni-trier.de/pid/06/3334.html;A New Method for Compiling Parallel Replacement Rules.;['https://dblp.uni-trier.de/pid/17/6905.html'];2;2007;320-321
https://dblp.uni-trier.de/pid/06/3334.html;Approximating Dependency Grammars Through Intersection of Regular Languages.;[];1;2004;281-292
https://dblp.uni-trier.de/pid/28/3680.html;Introducing Code Adviser: A DFA-driven Electronic Programming Tutor.;['https://dblp.uni-trier.de/pid/152/0486.html', 'https://dblp.uni-trier.de/pid/19/38.html'];3;2015;307-312
https://dblp.uni-trier.de/pid/28/3680.html;Computing Raster Images from Grid Picture Grammars.;['https://dblp.uni-trier.de/pid/d/FrankDrewes.html', 'https://dblp.uni-trier.de/pid/10/624.html', 'https://dblp.uni-trier.de/pid/k/JHKreowski.html'];4;2000;113-121
https://dblp.uni-trier.de/pid/09/1765.html;Smaller Representation of Finite State Automata.;['https://dblp.uni-trier.de/pid/89/931.html'];2;2011;118-129
https://dblp.uni-trier.de/pid/33/2837.html;Deterministic Caterpillar Expressions.;['https://dblp.uni-trier.de/pid/02/6009.html', 'https://dblp.uni-trier.de/pid/y/ShengYu.html'];3;2007;97-108
https://dblp.uni-trier.de/pid/82/2372.html;Term Validation of Distributed Hard Real-Time Applications.;['https://dblp.uni-trier.de/pid/l/GaelleLargeteauSkapin.html'];2;2002;262-269
https://dblp.uni-trier.de/pid/82/2372.html;Scheduling Hard Sporadic Tasks by Means of Finite Automata and Generating Functions.;['https://dblp.uni-trier.de/pid/86/106.html'];2;2001;87-100
