Author;Title;Co-Authors;No Authors;Year;Pagination
https://dblp.uni-trier.de/pid/85/2685.html;Large-Scale Training of SVMs with Automata Kernels.;['https://dblp.uni-trier.de/pid/77/5783.html', 'https://dblp.uni-trier.de/pid/03/5448.html'];3;2010;17-27
https://dblp.uni-trier.de/pid/85/2685.html;Filters for Efficient Composition of Weighted Finite-State Transducers.;['https://dblp.uni-trier.de/pid/73/924.html', 'https://dblp.uni-trier.de/pid/98/6688.html'];3;2010;28-38
https://dblp.uni-trier.de/pid/85/2685.html;3-Way Composition of Weighted Finite-State Transducers.;['https://dblp.uni-trier.de/pid/03/5448.html'];2;2008;262-273
https://dblp.uni-trier.de/pid/85/2685.html;OpenFst: A General and Efficient Weighted Finite-State Transducer Library.;['https://dblp.uni-trier.de/pid/73/924.html', 'https://dblp.uni-trier.de/pid/98/6688.html', 'https://dblp.uni-trier.de/pid/74/4110.html', 'https://dblp.uni-trier.de/pid/03/5448.html'];5;2007;11-23
https://dblp.uni-trier.de/pid/85/2685.html;A General Weighted Grammar Library.;['https://dblp.uni-trier.de/pid/03/5448.html', 'https://dblp.uni-trier.de/pid/09/246.html'];3;2004;23-34
https://dblp.uni-trier.de/pid/85/2685.html;An Efficient Pre-determinization Algorithm.;['https://dblp.uni-trier.de/pid/03/5448.html'];2;2003;83-95
https://dblp.uni-trier.de/pid/85/2685.html;p-Subsequentiable Transducers.;['https://dblp.uni-trier.de/pid/03/5448.html'];2;2002;24-34
https://dblp.uni-trier.de/pid/02/6397.html;Ternary Directed Acyclic Word Graphs.;['https://dblp.uni-trier.de/pid/88/1129.html', 'https://dblp.uni-trier.de/pid/35/1544.html', 'https://dblp.uni-trier.de/pid/s/AyumiShinohara.html'];4;2003;120-130
https://dblp.uni-trier.de/pid/37/1716.html;Deeper Connections Between LTL and Alternating Automata.;['https://dblp.uni-trier.de/pid/23/6970.html'];2;2005;238-249
https://dblp.uni-trier.de/pid/27/9125.html;Transductions Computed by PC-Systems of Monotone Deterministic Restarting Automata.;['https://dblp.uni-trier.de/pid/03/67.html', 'https://dblp.uni-trier.de/pid/57/9125.html'];3;2010;163-172
https://dblp.uni-trier.de/pid/88/7174.html;Implementation of State Elimination Using Heuristics.;['https://dblp.uni-trier.de/pid/h/YoSubHan.html'];2;2009;178-187
https://dblp.uni-trier.de/pid/35/4442.html;Problems on Finite Automata and the Exponential Time Hypothesis.;['https://dblp.uni-trier.de/pid/f/HenningFernau.html'];2;2016;89-100
https://dblp.uni-trier.de/pid/k/MartinKutrib.html;Syntax Checking Either Way.;['https://dblp.uni-trier.de/pid/70/6536-3.html'];2;2022;128-139
https://dblp.uni-trier.de/pid/k/MartinKutrib.html;On the Power of Pushing or Stationary Moves for Input-Driven Pushdown Automata.;['https://dblp.uni-trier.de/pid/58/2201.html', 'https://dblp.uni-trier.de/pid/55/10307.html'];3;2022;140-151
https://dblp.uni-trier.de/pid/k/MartinKutrib.html;Boolean Kernels of Context-Free Languages.;['https://dblp.uni-trier.de/pid/182/9958.html'];2;2021;152-164
https://dblp.uni-trier.de/pid/k/MartinKutrib.html;Input-Driven Multi-counter Automata.;['https://dblp.uni-trier.de/pid/58/2201.html', 'https://dblp.uni-trier.de/pid/55/10307.html'];3;2019;197-208
https://dblp.uni-trier.de/pid/k/MartinKutrib.html;Boosting Pushdown and Queue Machines by Preprocessing.;['https://dblp.uni-trier.de/pid/58/2201.html', 'https://dblp.uni-trier.de/pid/55/10307.html'];3;2018;28-40
https://dblp.uni-trier.de/pid/k/MartinKutrib.html;Parametrizing String Assembling Systems.;['https://dblp.uni-trier.de/pid/55/10307.html'];2;2018;236-247
https://dblp.uni-trier.de/pid/k/MartinKutrib.html;Transducing Reversibly with Finite State Machines.;['https://dblp.uni-trier.de/pid/58/2201.html', 'https://dblp.uni-trier.de/pid/55/10307.html'];3;2017;151-162
https://dblp.uni-trier.de/pid/k/MartinKutrib.html;The Degree of Irreversibility in Deterministic Finite Automata.;['https://dblp.uni-trier.de/pid/42/2723.html', 'https://dblp.uni-trier.de/pid/h/MarkusHolzer1.html'];3;2016;15-26
https://dblp.uni-trier.de/pid/k/MartinKutrib.html;Deterministic Stack Transducers.;['https://dblp.uni-trier.de/pid/84/2622.html', 'https://dblp.uni-trier.de/pid/75/5525.html'];3;2016;27-38
https://dblp.uni-trier.de/pid/k/MartinKutrib.html;Expressive Capacity of Concatenation Freeness.;['https://dblp.uni-trier.de/pid/55/10307.html'];2;2015;199-210
https://dblp.uni-trier.de/pid/k/MartinKutrib.html;Input-Driven Queue Automata: Finite Turns, Decidability, and Closure Properties.;['https://dblp.uni-trier.de/pid/58/2201.html', 'https://dblp.uni-trier.de/pid/96/438.html', 'https://dblp.uni-trier.de/pid/97/5115.html', 'https://dblp.uni-trier.de/pid/55/10307.html'];5;2013;232-243
https://dblp.uni-trier.de/pid/k/MartinKutrib.html;On the Descriptional Complexity of the Window Size for Deterministic Restarting Automata.;['https://dblp.uni-trier.de/pid/03/67.html'];2;2012;253-264
https://dblp.uni-trier.de/pid/k/MartinKutrib.html;Gaining Power by Input Operations: Finite Automata and Beyond.;['https://dblp.uni-trier.de/pid/h/MarkusHolzer1.html'];2;2011;16-29
https://dblp.uni-trier.de/pid/k/MartinKutrib.html;Nondeterministic State Complexity of Star-Free Languages.;['https://dblp.uni-trier.de/pid/h/MarkusHolzer1.html', 'https://dblp.uni-trier.de/pid/70/9958.html'];3;2011;178-189
https://dblp.uni-trier.de/pid/k/MartinKutrib.html;Two-Party Watson-Crick Computations.;['https://dblp.uni-trier.de/pid/58/2201.html'];2;2010;191-200
https://dblp.uni-trier.de/pid/k/MartinKutrib.html;Cellular Automata with Sparse Communication.;['https://dblp.uni-trier.de/pid/58/2201.html'];2;2009;34-43
https://dblp.uni-trier.de/pid/k/MartinKutrib.html;Nondeterministic Finite Automata-Recent Results on the Descriptional and Computational Complexity.;['https://dblp.uni-trier.de/pid/h/MarkusHolzer1.html'];2;2008;1-16
https://dblp.uni-trier.de/pid/k/MartinKutrib.html;Regulated Nondeterminism in Pushdown Automata.;['https://dblp.uni-trier.de/pid/58/2201.html', 'https://dblp.uni-trier.de/pid/07/2826.html'];3;2007;85-96
https://dblp.uni-trier.de/pid/k/MartinKutrib.html;Hybrid Extended Finite Automata.;['https://dblp.uni-trier.de/pid/49/1455.html', 'https://dblp.uni-trier.de/pid/h/MarkusHolzer1.html'];3;2006;34-45
https://dblp.uni-trier.de/pid/k/MartinKutrib.html;Some Non-semi-decidability Problems for Linear and Deterministic Context-Free Languages.;['https://dblp.uni-trier.de/pid/49/1455.html', 'https://dblp.uni-trier.de/pid/h/MarkusHolzer1.html'];3;2004;68-79
https://dblp.uni-trier.de/pid/k/MartinKutrib.html;State Complexity of Basic Operations on Nondeterministic Finite Automata.;['https://dblp.uni-trier.de/pid/h/MarkusHolzer1.html'];2;2002;148-157
https://dblp.uni-trier.de/pid/k/MartinKutrib.html;Improving Raster Image Run-Length Encoding Using Data Order.;['https://dblp.uni-trier.de/pid/h/MarkusHolzer1.html'];2;2001;161-176
https://dblp.uni-trier.de/pid/59/1067.html;On the Computation of Some Standard Distances Between Probabilistic Automata.;['https://dblp.uni-trier.de/pid/77/5783.html', 'https://dblp.uni-trier.de/pid/03/5448.html'];3;2006;137-149
https://dblp.uni-trier.de/pid/73/3804.html;On the Size of Deterministic Finite Automata.;['https://dblp.uni-trier.de/pid/78/5300.html'];2;2001;202-213
https://dblp.uni-trier.de/pid/38/4510.html;LALBLC A Program Testing the Equivalence of dpda's.;['https://dblp.uni-trier.de/pid/10/4341.html'];2;2013;169-180
https://dblp.uni-trier.de/pid/154/8959.html;Computational Completeness of Path-Structured Graph-Controlled Insertion-Deletion Systems.;['https://dblp.uni-trier.de/pid/f/HenningFernau.html', 'https://dblp.uni-trier.de/pid/82/730.html'];3;2017;89-100
https://dblp.uni-trier.de/pid/86/6093.html;Nondeterministic Moore Automata and Brzozowski's Algorithm.;['https://dblp.uni-trier.de/pid/g/GiusiCastiglione.html', 'https://dblp.uni-trier.de/pid/05/2717.html'];3;2011;88-99
https://dblp.uni-trier.de/pid/86/6093.html;A Challenging Family of Automata for Classical Minimization Algorithms.;['https://dblp.uni-trier.de/pid/g/GiusiCastiglione.html', 'https://dblp.uni-trier.de/pid/28/881.html'];3;2010;251-260
https://dblp.uni-trier.de/pid/86/6093.html;On Extremal Cases of Hopcroft's Algorithm.;['https://dblp.uni-trier.de/pid/g/GiusiCastiglione.html', 'https://dblp.uni-trier.de/pid/05/2717.html'];3;2009;14-23
https://dblp.uni-trier.de/pid/50/6664.html;A Simple Extension to Finite Tree Automata for Defining Sets of Labeled, Connected Graphs.;['https://dblp.uni-trier.de/pid/17/927.html'];2;2019;121-132
https://dblp.uni-trier.de/pid/50/6664.html;Two-Dimensional Pattern Matching Against Basic Picture Languages.;['https://dblp.uni-trier.de/pid/38/5599.html', 'https://dblp.uni-trier.de/pid/146/7766.html'];3;2019;209-221
https://dblp.uni-trier.de/pid/50/6664.html;Complexity of Sets of Two-Dimensional Patterns.;[];1;2016;236-247
https://dblp.uni-trier.de/pid/50/6664.html;(Un)decidability of the Emptiness Problem for Multi-dimensional Context-Free Grammars.;[];1;2015;250-262
https://dblp.uni-trier.de/pid/50/6664.html;Comparing Two-Dimensional One-Marker Automata to Sgraffito Automata.;['https://dblp.uni-trier.de/pid/38/5599.html', 'https://dblp.uni-trier.de/pid/03/67.html'];3;2013;268-279
https://dblp.uni-trier.de/pid/50/6664.html;Restarting Tiling Automata.;['https://dblp.uni-trier.de/pid/38/5599.html'];2;2012;289-300
https://dblp.uni-trier.de/pid/19/7.html;Deciding Synchronous Kleene Algebra with Derivatives.;['https://dblp.uni-trier.de/pid/42/4087.html', 'https://dblp.uni-trier.de/pid/165/8694.html', 'https://dblp.uni-trier.de/pid/n/NelmaMoreira.html'];4;2015;49-62
https://dblp.uni-trier.de/pid/24/3612.html;Minimal Unambiguous eNFA.;[];1;2004;190-201
https://dblp.uni-trier.de/pid/48/4007.html;A Completion Algorithm for Lattice Tree Automata.;['https://dblp.uni-trier.de/pid/03/3582.html', 'https://dblp.uni-trier.de/pid/52/579.html', 'https://dblp.uni-trier.de/pid/24/10259.html'];4;2013;134-145
https://dblp.uni-trier.de/pid/85/1157.html;On-the-Fly Branching Bisimulation Minimization for Compositional Analysis.;['https://dblp.uni-trier.de/pid/88/4294.html', 'https://dblp.uni-trier.de/pid/12/3055.html'];3;2006;219-229
https://dblp.uni-trier.de/pid/a/PAAbdulla.html;Composed Bisimulation for Tree Automata.;['https://dblp.uni-trier.de/pid/b/AhmedBouajjani.html', 'https://dblp.uni-trier.de/pid/64/6177.html', 'https://dblp.uni-trier.de/pid/34/5632.html', 'https://dblp.uni-trier.de/pid/51/533.html'];5;2008;212-222
https://dblp.uni-trier.de/pid/a/PAAbdulla.html;Bisimulation Minimization of Tree Automata.;['https://dblp.uni-trier.de/pid/34/5632.html', 'https://dblp.uni-trier.de/pid/75/5525.html'];3;2006;173-185
https://dblp.uni-trier.de/pid/a/PAAbdulla.html;Minimization of Non-deterministic Automata with Large Alphabets.;['https://dblp.uni-trier.de/pid/76/2580.html', 'https://dblp.uni-trier.de/pid/34/5632.html', 'https://dblp.uni-trier.de/pid/05/1762.html'];4;2005;31-42
https://dblp.uni-trier.de/pid/21/8279.html;Stamina: Stabilisation Monoids in Automata Theory.;['https://dblp.uni-trier.de/pid/93/8654.html', 'https://dblp.uni-trier.de/pid/22/250.html', 'https://dblp.uni-trier.de/pid/140/7385.html'];4;2017;101-112
https://dblp.uni-trier.de/pid/76/2580.html;Minimization of Non-deterministic Automata with Large Alphabets.;['https://dblp.uni-trier.de/pid/a/PAAbdulla.html', 'https://dblp.uni-trier.de/pid/34/5632.html', 'https://dblp.uni-trier.de/pid/05/1762.html'];4;2005;31-42
https://dblp.uni-trier.de/pid/d/VolkerDiekert.html;Complexity Results and the Growths of Hairpin Completions of Regular Languages (Extended Abstract).;['https://dblp.uni-trier.de/pid/31/7223.html'];2;2010;105-114
https://dblp.uni-trier.de/pid/o/JOteroP.html;Robust Spelling Correction.;['https://dblp.uni-trier.de/pid/v/MVilaresF.html', 'https://dblp.uni-trier.de/pid/v/JesusVilares.html'];3;2005;319-328
https://dblp.uni-trier.de/pid/o/JOteroP.html;Regional Finite-State Error Repair.;['https://dblp.uni-trier.de/pid/v/MVilaresF.html', 'https://dblp.uni-trier.de/pid/g/JorgeGranaGil.html'];3;2004;269-280
https://dblp.uni-trier.de/pid/84/2622.html;Deterministic Stack Transducers.;['https://dblp.uni-trier.de/pid/75/5525.html', 'https://dblp.uni-trier.de/pid/k/MartinKutrib.html'];3;2016;27-38
https://dblp.uni-trier.de/pid/79/2132.html;On Parsing and Condensing Substrings of LR Languages in Linear Time.;[];1;1998;22-42
https://dblp.uni-trier.de/pid/48/1067.html;Automata-Based Representations for Arithmetic Constraints in Automated Verification.;['https://dblp.uni-trier.de/pid/07/3368.html'];2;2002;282-288
https://dblp.uni-trier.de/pid/27/606.html;Star Normal Form, Rational Expressions, and Glushkov WFAs Properties.;['https://dblp.uni-trier.de/pid/77/3565.html'];2;2002;248-254
https://dblp.uni-trier.de/pid/27/606.html;Glushkov Construction for Multiplicities.;['https://dblp.uni-trier.de/pid/77/3565.html'];2;2000;67-79
https://dblp.uni-trier.de/pid/27/606.html;SEA: A Symbolic Environment for Automata Theory.;['https://dblp.uni-trier.de/pid/32/6467.html', 'https://dblp.uni-trier.de/pid/77/3565.html', 'https://dblp.uni-trier.de/pid/30/6143.html', 'https://dblp.uni-trier.de/pid/d/GerardDuchamp.html', 'https://dblp.uni-trier.de/pid/68/4299.html'];6;1999;13-26
https://dblp.uni-trier.de/pid/27/606.html;Operations over Automata with Multiplicities.;['https://dblp.uni-trier.de/pid/d/GerardDuchamp.html', 'https://dblp.uni-trier.de/pid/68/4299.html'];3;1998;183-191
https://dblp.uni-trier.de/pid/t/JormaTarhio.html;On String Matching in Chunked Texts.;['https://dblp.uni-trier.de/pid/69/340.html'];2;2007;157-167
https://dblp.uni-trier.de/pid/41/1330.html;Solving Parity Games: Explicit vs Symbolic.;['https://dblp.uni-trier.de/pid/157/8638.html', 'https://dblp.uni-trier.de/pid/v/MosheYVardi.html'];3;2018;159-172
https://dblp.uni-trier.de/pid/41/1330.html;Solving Parity Games Using an Automata-Based Algorithm.;['https://dblp.uni-trier.de/pid/157/8638.html', 'https://dblp.uni-trier.de/pid/08/10670.html', 'https://dblp.uni-trier.de/pid/v/MosheYVardi.html'];4;2016;64-76
https://dblp.uni-trier.de/pid/61/3416.html;On the Equivalence Problem for Programs with Mode Switching.;['https://dblp.uni-trier.de/pid/65/922.html', 'https://dblp.uni-trier.de/pid/84/5934.html'];3;2005;351-352
https://dblp.uni-trier.de/pid/74/5910.html;Automata to Recognize Finite and Infinite Words with at Least Two Factorizations on a Given Finite Set.;[];1;1998;220-225
https://dblp.uni-trier.de/pid/31/4878.html;Symbolic Dynamics, Flower Automata and Infinite Traces.;['https://dblp.uni-trier.de/pid/79/5413.html', 'https://dblp.uni-trier.de/pid/47/9125.html'];3;2010;135-142
https://dblp.uni-trier.de/pid/37/4530.html;In Vitro Implementation of Finite-State Machines.;['https://dblp.uni-trier.de/pid/52/2077.html', 'https://dblp.uni-trier.de/pid/68/5365.html', 'https://dblp.uni-trier.de/pid/56/6114.html', 'https://dblp.uni-trier.de/pid/91/5747.html', 'https://dblp.uni-trier.de/pid/05/2645.html', 'https://dblp.uni-trier.de/pid/56/545.html'];7;1997;56-74
https://dblp.uni-trier.de/pid/81/5479.html;The Automata Theory Package omega.;['https://dblp.uni-trier.de/pid/47/6609.html', 'https://dblp.uni-trier.de/pid/92/768.html', 'https://dblp.uni-trier.de/pid/77/6082.html'];4;1997;228-231
https://dblp.uni-trier.de/pid/h/YoSubHan.html;How to Settle the ReDoS Problem: Back to the Classical Automata Theory.;['https://dblp.uni-trier.de/pid/321/6407.html', 'https://dblp.uni-trier.de/pid/228/6835.html'];3;2022;34-49
https://dblp.uni-trier.de/pid/h/YoSubHan.html;A General Architecture of Oritatami Systems for Simulating Arbitrary Finite Automata.;['https://dblp.uni-trier.de/pid/139/8245.html', 'https://dblp.uni-trier.de/pid/223/4929.html', 'https://dblp.uni-trier.de/pid/70/1118.html'];4;2019;146-157
https://dblp.uni-trier.de/pid/h/YoSubHan.html;Online Stochastic Pattern Matching.;['https://dblp.uni-trier.de/pid/223/4918.html'];2;2018;121-132
https://dblp.uni-trier.de/pid/h/YoSubHan.html;Alignment Distance of Regular Tree Languages.;['https://dblp.uni-trier.de/pid/71/9491.html'];2;2017;126-137
https://dblp.uni-trier.de/pid/h/YoSubHan.html;Left is Better than Right for Reducing Nondeterminism of NFAs.;['https://dblp.uni-trier.de/pid/71/9491.html'];2;2014;238-251
https://dblp.uni-trier.de/pid/h/YoSubHan.html;Approximate Matching between a Context-Free Grammar and a Finite-State Automaton.;['https://dblp.uni-trier.de/pid/71/9491.html', 'https://dblp.uni-trier.de/pid/02/6009.html'];3;2013;146-157
https://dblp.uni-trier.de/pid/h/YoSubHan.html;A Cellular Automaton Model for Car Traffic with a Form-One-Lane Rule.;['https://dblp.uni-trier.de/pid/71/9491.html'];2;2011;154-165
https://dblp.uni-trier.de/pid/h/YoSubHan.html;Implementation of State Elimination Using Heuristics.;['https://dblp.uni-trier.de/pid/88/7174.html'];2;2009;178-187
https://dblp.uni-trier.de/pid/h/YoSubHan.html;Shorter Regular Expressions from Finite-State Automata.;['https://dblp.uni-trier.de/pid/w/DerickWood.html'];2;2005;141-152
https://dblp.uni-trier.de/pid/h/YoSubHan.html;The Generalization of Generalized Automata: Expression Automata.;['https://dblp.uni-trier.de/pid/w/DerickWood.html'];2;2004;156-166
https://dblp.uni-trier.de/pid/80/6105.html;Complexity of Inferring Local Transition Functions of Discrete Dynamical Systems.;['https://dblp.uni-trier.de/pid/73/8044.html', 'https://dblp.uni-trier.de/pid/09/7561.html', 'https://dblp.uni-trier.de/pid/52/991.html', 'https://dblp.uni-trier.de/pid/94/2464.html', 'https://dblp.uni-trier.de/pid/s/RichardEdwinStearns.html'];6;2015;21-34
https://dblp.uni-trier.de/pid/318/2744.html;Energy Complexity of Regular Language Recognition.;['https://dblp.uni-trier.de/pid/318/2800.html', 'https://dblp.uni-trier.de/pid/61/61.html', 'https://dblp.uni-trier.de/pid/11/4210.html'];4;2022;200-211
https://dblp.uni-trier.de/pid/n/NadiaNedjah.html;Minimal Adaptive Pattern-Matching Automata for Efficient Term Rewriting.;['https://dblp.uni-trier.de/pid/20/999.html'];2;2001;221-233
https://dblp.uni-trier.de/pid/n/JNiehren.html;Early Nested Word Automata for XPath Query Answering on XML Streams.;['https://dblp.uni-trier.de/pid/80/1808.html', 'https://dblp.uni-trier.de/pid/51/7012.html', 'https://dblp.uni-trier.de/pid/09/8910.html', 'https://dblp.uni-trier.de/pid/79/7504.html'];5;2013;292-305
https://dblp.uni-trier.de/pid/n/JNiehren.html;Streamable Fragments of Forward XPath.;['https://dblp.uni-trier.de/pid/51/7012.html'];2;2011;3-15
https://dblp.uni-trier.de/pid/49/4233.html;Finite-State Molecular Computing.;['https://dblp.uni-trier.de/pid/15/3718.html', 'https://dblp.uni-trier.de/pid/53/947.html', 'https://dblp.uni-trier.de/pid/20/118.html'];4;2003;309-310
https://dblp.uni-trier.de/pid/77/5317.html;State Complexity and the Monoid of Transformations of a Finite Set.;['https://dblp.uni-trier.de/pid/65/5953.html', 'https://dblp.uni-trier.de/pid/s/JeffreyShallit.html'];3;2004;213-224
https://dblp.uni-trier.de/pid/81/3428.html;Categorial Grammars with Iterated Types form a Strict Hierarchy of k-Valued Languages.;['https://dblp.uni-trier.de/pid/b/DenisBechet.html', 'https://dblp.uni-trier.de/pid/60/452.html'];3;2011;42-52
https://dblp.uni-trier.de/pid/321/6412.html;A Similarity Measure for Formal Languages Based on Convergent Geometric Series.;['https://dblp.uni-trier.de/pid/130/3850.html', 'https://dblp.uni-trier.de/pid/181/2007-1.html'];3;2022;80-92
https://dblp.uni-trier.de/pid/37/1275.html;Counting the Solutions of Presburger Equations without Enumerating Them.;['https://dblp.uni-trier.de/pid/72/5451.html'];2;2001;40-51
https://dblp.uni-trier.de/pid/55/10307.html;On the Power of Pushing or Stationary Moves for Input-Driven Pushdown Automata.;['https://dblp.uni-trier.de/pid/k/MartinKutrib.html', 'https://dblp.uni-trier.de/pid/58/2201.html'];3;2022;140-151
https://dblp.uni-trier.de/pid/55/10307.html;Input-Driven Multi-counter Automata.;['https://dblp.uni-trier.de/pid/k/MartinKutrib.html', 'https://dblp.uni-trier.de/pid/58/2201.html'];3;2019;197-208
https://dblp.uni-trier.de/pid/55/10307.html;Boosting Pushdown and Queue Machines by Preprocessing.;['https://dblp.uni-trier.de/pid/k/MartinKutrib.html', 'https://dblp.uni-trier.de/pid/58/2201.html'];3;2018;28-40
https://dblp.uni-trier.de/pid/55/10307.html;Parametrizing String Assembling Systems.;['https://dblp.uni-trier.de/pid/k/MartinKutrib.html'];2;2018;236-247
https://dblp.uni-trier.de/pid/55/10307.html;Transducing Reversibly with Finite State Machines.;['https://dblp.uni-trier.de/pid/k/MartinKutrib.html', 'https://dblp.uni-trier.de/pid/58/2201.html'];3;2017;151-162
https://dblp.uni-trier.de/pid/55/10307.html;Expressive Capacity of Concatenation Freeness.;['https://dblp.uni-trier.de/pid/k/MartinKutrib.html'];2;2015;199-210
https://dblp.uni-trier.de/pid/55/10307.html;Input-Driven Queue Automata: Finite Turns, Decidability, and Closure Properties.;['https://dblp.uni-trier.de/pid/k/MartinKutrib.html', 'https://dblp.uni-trier.de/pid/58/2201.html', 'https://dblp.uni-trier.de/pid/96/438.html', 'https://dblp.uni-trier.de/pid/97/5115.html'];5;2013;232-243
https://dblp.uni-trier.de/pid/80/1300.html;Symbolic Implementation of Alternating Automata.;['https://dblp.uni-trier.de/pid/13/5961.html', 'https://dblp.uni-trier.de/pid/49/690.html', 'https://dblp.uni-trier.de/pid/83/563.html', 'https://dblp.uni-trier.de/pid/75/286.html'];5;2006;208-218
https://dblp.uni-trier.de/pid/59/9687.html;Ordered Context-Free Grammars.;['https://dblp.uni-trier.de/pid/59/6051.html'];2;2022;53-66
https://dblp.uni-trier.de/pid/59/9687.html;Memoized Regular Expressions.;['https://dblp.uni-trier.de/pid/59/6051.html', 'https://dblp.uni-trier.de/pid/296/0334.html', 'https://dblp.uni-trier.de/pid/292/8936.html'];4;2021;39-52
https://dblp.uni-trier.de/pid/59/9687.html;On the Semantics of Atomic Subgroups in Practical Regular Expressions.;['https://dblp.uni-trier.de/pid/59/6051.html', 'https://dblp.uni-trier.de/pid/w/BruceWWatson.html', 'https://dblp.uni-trier.de/pid/182/6157.html'];4;2017;14-26
https://dblp.uni-trier.de/pid/59/9687.html;Analyzing Matching Time Behavior of Backtracking Regular Expression Matchers by Using Ambiguity of NFA.;['https://dblp.uni-trier.de/pid/182/6157.html', 'https://dblp.uni-trier.de/pid/59/6051.html', 'https://dblp.uni-trier.de/pid/w/BruceWWatson.html'];4;2016;322-334
https://dblp.uni-trier.de/pid/59/9687.html;On the Semantics of Regular Expression Parsing in the Wild.;['https://dblp.uni-trier.de/pid/59/6051.html'];2;2015;292-304
https://dblp.uni-trier.de/pid/89/7966.html;Tree Template Matching in Ranked Ordered Trees by Pushdown Automata.;['https://dblp.uni-trier.de/pid/01/5035.html', 'https://dblp.uni-trier.de/pid/21/1027.html', 'https://dblp.uni-trier.de/pid/78/5300.html', 'https://dblp.uni-trier.de/pid/i/CSIliopoulos.html'];5;2011;273-281
https://dblp.uni-trier.de/pid/u/EskoUkkonen.html;Size Reduction of Multitape Automata.;['https://dblp.uni-trier.de/pid/56/5603.html', 'https://dblp.uni-trier.de/pid/45/6004.html'];3;2005;307-318
https://dblp.uni-trier.de/pid/u/EskoUkkonen.html;Size Reduction of Multitape Automata.;['https://dblp.uni-trier.de/pid/56/5603.html', 'https://dblp.uni-trier.de/pid/45/6004.html'];3;2004;329-330
https://dblp.uni-trier.de/pid/u/EskoUkkonen.html;Bideterministic Automata and Minimal Representations of Regular Languages.;['https://dblp.uni-trier.de/pid/56/5603.html'];2;2003;61-71
https://dblp.uni-trier.de/pid/48/3952.html;From Regular Weighted Expressions to Finite Automata.;['https://dblp.uni-trier.de/pid/30/6143.html', 'https://dblp.uni-trier.de/pid/68/4299.html', 'https://dblp.uni-trier.de/pid/83/2086.html'];4;2003;49-60
https://dblp.uni-trier.de/pid/27/10482.html;On Syntactic Complexity of Circular Semi-flower Automata.;['https://dblp.uni-trier.de/pid/58/10670.html'];2;2018;312-323
https://dblp.uni-trier.de/pid/44/4585.html;Proving Sequential Function Chart Programs Using Automata.;['https://dblp.uni-trier.de/pid/98/1205.html', 'https://dblp.uni-trier.de/pid/67/3488.html'];3;1998;149-163
https://dblp.uni-trier.de/pid/05/2645.html;In Vitro Implementation of Finite-State Machines.;['https://dblp.uni-trier.de/pid/52/2077.html', 'https://dblp.uni-trier.de/pid/37/4530.html', 'https://dblp.uni-trier.de/pid/68/5365.html', 'https://dblp.uni-trier.de/pid/56/6114.html', 'https://dblp.uni-trier.de/pid/91/5747.html', 'https://dblp.uni-trier.de/pid/56/545.html'];7;1997;56-74
https://dblp.uni-trier.de/pid/97/10871.html;New Algorithms for Manipulating Sequence BDDs.;[];1;2019;108-120
https://dblp.uni-trier.de/pid/50/1007.html;On the Uniform Random Generation of Non Deterministic Automata Up to Isomorphism.;['https://dblp.uni-trier.de/pid/165/8672.html'];2;2015;140-152
https://dblp.uni-trier.de/pid/50/1007.html;Random Generation and Enumeration of Accessible Deterministic Real-Time Pushdown Automata.;['https://dblp.uni-trier.de/pid/165/8672.html'];2;2015;153-164
https://dblp.uni-trier.de/pid/50/1007.html;Enhancing Approximations for Regular Reachability Analysis.;['https://dblp.uni-trier.de/pid/132/1983.html', 'https://dblp.uni-trier.de/pid/95/4315.html'];3;2013;331-339
https://dblp.uni-trier.de/pid/50/1007.html;On Positive TAGED with a Bounded Number of Constraints.;['https://dblp.uni-trier.de/pid/80/9679.html', 'https://dblp.uni-trier.de/pid/95/4315.html'];3;2012;329-336
https://dblp.uni-trier.de/pid/50/1007.html;Loops and Overloops for Tree Walking Automata.;['https://dblp.uni-trier.de/pid/80/9679.html', 'https://dblp.uni-trier.de/pid/95/4315.html'];3;2011;166-177
https://dblp.uni-trier.de/pid/50/1007.html;Random Generation of Deterministic Tree (Walking) Automata.;['https://dblp.uni-trier.de/pid/28/881.html', 'https://dblp.uni-trier.de/pid/62/6048.html'];3;2009;115-124
https://dblp.uni-trier.de/pid/50/1007.html;TAGED Approximations for Temporal Properties Model-Checking.;['https://dblp.uni-trier.de/pid/29/1213.html', 'https://dblp.uni-trier.de/pid/95/4315.html'];3;2009;135-144
https://dblp.uni-trier.de/pid/50/1007.html;Automata for Pro-V Topologies.;[];1;2000;135-144
https://dblp.uni-trier.de/pid/73/3073.html;Minimalizations of NFA Using the Universal Automaton.;[];1;2004;325-326
